{"schema_version":3,"audit_id":"audit_run_bc31520c3a704c07","run_id":"run_bc31520c3a704c07","seal_event_digest":"sha256:75f8d8195a6e18a17820bbcdba0a2011f7a5bf1ce065f3be0ef019a87422dea3","baseline_head":"c6c224cfee0edc862c1554ce757a30c2b340e141","seal_digest":"sha256:78c0d8057804e7280353e90e84b2a082240f4ba3a59bb8d4102b8b0039d09058","manifest_digest":"sha256:7b4faad98091ef78411e8e1399a48e9303584cbb1fbd9ae81343514430627538","changed_paths":["catalog/indexes/manifest.json","catalog/runs/run_bc31520c3a704c07/demand.json","catalog/runs/run_bc31520c3a704c07/events/0-init.json","catalog/runs/run_bc31520c3a704c07/events/1-maintenance.json","catalog/runs/run_bc31520c3a704c07/events/2-issues.json","catalog/runs/run_bc31520c3a704c07/events/3-paused_for_assessment.json","catalog/runs/run_bc31520c3a704c07/events/4-context.json","catalog/runs/run_bc31520c3a704c07/events/5-paused_for_targets.json","catalog/runs/run_bc31520c3a704c07/events/6-targets.json","catalog/runs/run_bc31520c3a704c07/events/7-gate.json","catalog/runs/run_bc31520c3a704c07/gate-evidence/analysis_binding_test.stderr.log","catalog/runs/run_bc31520c3a704c07/gate-evidence/analysis_binding_test.stdout.log","catalog/runs/run_bc31520c3a704c07/gate-evidence/catalog_impact.stderr.log","catalog/runs/run_bc31520c3a704c07/gate-evidence/catalog_impact.stdout.log","catalog/runs/run_bc31520c3a704c07/gate-evidence/catalog_reset_test.stderr.log","catalog/runs/run_bc31520c3a704c07/gate-evidence/catalog_reset_test.stdout.log","catalog/runs/run_bc31520c3a704c07/gate-evidence/catalog_status.stderr.log","catalog/runs/run_bc31520c3a704c07/gate-evidence/catalog_status.stdout.log","catalog/runs/run_bc31520c3a704c07/gate-evidence/catalog_validate.stderr.log","catalog/runs/run_bc31520c3a704c07/gate-evidence/catalog_validate.stdout.log","catalog/runs/run_bc31520c3a704c07/gate-evidence/evaluation_binding_test.stderr.log","catalog/runs/run_bc31520c3a704c07/gate-evidence/evaluation_binding_test.stdout.log","catalog/runs/run_bc31520c3a704c07/gate-evidence/issue_intake_test.stderr.log","catalog/runs/run_bc31520c3a704c07/gate-evidence/issue_intake_test.stdout.log","catalog/runs/run_bc31520c3a704c07/gate-evidence/issue_pipeline_test.stderr.log","catalog/runs/run_bc31520c3a704c07/gate-evidence/issue_pipeline_test.stdout.log","catalog/runs/run_bc31520c3a704c07/gate-evidence/issue_response_ledger_test.stderr.log","catalog/runs/run_bc31520c3a704c07/gate-evidence/issue_response_ledger_test.stdout.log","catalog/runs/run_bc31520c3a704c07/gate-evidence/issue_stage_test.stderr.log","catalog/runs/run_bc31520c3a704c07/gate-evidence/issue_stage_test.stdout.log","catalog/runs/run_bc31520c3a704c07/gate-evidence/nightly_controller_test.stderr.log","catalog/runs/run_bc31520c3a704c07/gate-evidence/nightly_controller_test.stdout.log","catalog/runs/run_bc31520c3a704c07/gate-evidence/nightly_legacy_absence_test.stderr.log","catalog/runs/run_bc31520c3a704c07/gate-evidence/nightly_legacy_absence_test.stdout.log","catalog/runs/run_bc31520c3a704c07/gate-evidence/nightly_runtime_test.stderr.log","catalog/runs/run_bc31520c3a704c07/gate-evidence/nightly_runtime_test.stdout.log","catalog/runs/run_bc31520c3a704c07/gate-evidence/pack_core_test.stderr.log","catalog/runs/run_bc31520c3a704c07/gate-evidence/pack_core_test.stdout.log","catalog/runs/run_bc31520c3a704c07/gate-evidence/pack_destination_test.stderr.log","catalog/runs/run_bc31520c3a704c07/gate-evidence/pack_destination_test.stdout.log","catalog/runs/run_bc31520c3a704c07/gate-evidence/pack_preflight_test.stderr.log","catalog/runs/run_bc31520c3a704c07/gate-evidence/pack_preflight_test.stdout.log","catalog/runs/run_bc31520c3a704c07/gate-evidence/pack_promotion_test.stderr.log","catalog/runs/run_bc31520c3a704c07/gate-evidence/pack_promotion_test.stdout.log","catalog/runs/run_bc31520c3a704c07/gate-evidence/pack_proof_test.stderr.log","catalog/runs/run_bc31520c3a704c07/gate-evidence/pack_proof_test.stdout.log","catalog/runs/run_bc31520c3a704c07/gate-evidence/pack_schema_test.stderr.log","catalog/runs/run_bc31520c3a704c07/gate-evidence/pack_schema_test.stdout.log","catalog/runs/run_bc31520c3a704c07/gate-evidence/path_safety_test.stderr.log","catalog/runs/run_bc31520c3a704c07/gate-evidence/path_safety_test.stdout.log","catalog/runs/run_bc31520c3a704c07/gate-evidence/publish_boundary.stderr.log","catalog/runs/run_bc31520c3a704c07/gate-evidence/publish_boundary.stdout.log","catalog/runs/run_bc31520c3a704c07/gate-evidence/publish_check.stderr.log","catalog/runs/run_bc31520c3a704c07/gate-evidence/publish_check.stdout.log","catalog/runs/run_bc31520c3a704c07/gate-evidence/publish_links.stderr.log","catalog/runs/run_bc31520c3a704c07/gate-evidence/publish_links.stdout.log","catalog/runs/run_bc31520c3a704c07/gate-evidence/publish_pack_v3_test.stderr.log","catalog/runs/run_bc31520c3a704c07/gate-evidence/publish_pack_v3_test.stdout.log","catalog/runs/run_bc31520c3a704c07/gate-evidence/publish_summaries.stderr.log","catalog/runs/run_bc31520c3a704c07/gate-evidence/publish_summaries.stdout.log","catalog/runs/run_bc31520c3a704c07/gate-evidence/relations_v2_test.stderr.log","catalog/runs/run_bc31520c3a704c07/gate-evidence/relations_v2_test.stdout.log","catalog/runs/run_bc31520c3a704c07/gate-evidence/skill_extraction_test.stderr.log","catalog/runs/run_bc31520c3a704c07/gate-evidence/skill_extraction_test.stdout.log","catalog/runs/run_bc31520c3a704c07/gate-evidence/skill_normalization_bootstrap_test.stderr.log","catalog/runs/run_bc31520c3a704c07/gate-evidence/skill_normalization_bootstrap_test.stdout.log","catalog/runs/run_bc31520c3a704c07/gate-evidence/source_http_classifier_test.stderr.log","catalog/runs/run_bc31520c3a704c07/gate-evidence/source_http_classifier_test.stdout.log","catalog/runs/run_bc31520c3a704c07/issue-drafts.json","catalog/runs/run_bc31520c3a704c07/issue-workload.json","catalog/runs/run_bc31520c3a704c07/outputs/gate-result.json","catalog/runs/run_bc31520c3a704c07/outputs/init-evidence.json","catalog/runs/run_bc31520c3a704c07/outputs/issue-assessment-handoff.json","catalog/runs/run_bc31520c3a704c07/outputs/issues-finalized.json","catalog/runs/run_bc31520c3a704c07/outputs/issues-prepared.json","catalog/runs/run_bc31520c3a704c07/outputs/maintenance.json","catalog/runs/run_bc31520c3a704c07/outputs/run-context.json","catalog/runs/run_bc31520c3a704c07/outputs/target-execution-handoff.json","catalog/runs/run_bc31520c3a704c07/outputs/targets-finalized.json","catalog/runs/run_bc31520c3a704c07/stages-issues.json","catalog/runs/run_bc31520c3a704c07/target-result.json","catalog/sources/registry.yaml","catalog/sources/snapshots/src_https-github-com-anthropics-skills-anthropic-agent-skills_04f79b56-b29e7cf65e5c.json","catalog/sources/snapshots/src_https-github-com-coderabbitai-skills-coderabbit-skills_8f2a22eb-bbb4ab25a7f1.json","catalog/sources/snapshots/src_https-github-com-coreyhaines31-marketingskills-marketing-skills-corey-haines_ef920698-7868cb9251fa.json","catalog/sources/snapshots/src_https-github-com-cuga-project-cuga-agent-cuga-agent-ibm-research_5709bc42-35c93aaf36c0.json","catalog/sources/snapshots/src_https-github-com-figma-mcp-server-guide-figma-mcp-skills_dde79ddd-c80480bbd84b.json","catalog/sources/snapshots/src_https-github-com-fujishigetemma-semantic-scholar-mcp-semantic-scholar-mcp-server_1c7ee5c5-ead98e835620.json","catalog/sources/snapshots/src_https-github-com-hermeticormus-markdown-discipline-skills-markdown-discipline-skills_ddaf87e0-ae8c782f68db.json","catalog/sources/snapshots/src_https-github-com-jupyterlab-jupyter-ai-jupyter-ai-jupyterlab_e47112b5-1e7ad24042b2.json","catalog/sources/snapshots/src_https-github-com-k-dense-ai-scientific-agent-skills-k-dense-scientific-agent-skills_5bdb6d39-d767725c6e93.json","catalog/sources/snapshots/src_https-github-com-kozz36-frontend-designer-skill-frontend-designer-skill_929a1309-5e4dc12811bd.json","catalog/sources/snapshots/src_https-github-com-mcollina-skills-matteo-collina-s-skills_faf2f289-a88a866db5dc.json","catalog/sources/snapshots/src_https-github-com-microsoft-skills-microsoft-agent-skills_0215423e-1f28ae4c5e5e.json","catalog/sources/snapshots/src_https-github-com-openclaw-agent-skills-openclaw-agent-skills_088582b8-2a409d348a4b.json","catalog/sources/snapshots/src_https-github-com-phuryn-pm-skills-pm-skills-marketplace-phuryn_8ac36372-18468a95b427.json","catalog/sources/snapshots/src_https-github-com-product-on-purpose-pm-skills-pm-skills-product-on-purpose_f2ce15e5-31f38ed48fc5.json","catalog/sources/snapshots/src_https-github-com-southleft-skills-for-figma-skills-for-figma-southleft_ea9f2b3d-79bda1e76044.json","catalog/sources/snapshots/src_https-github-com-thatrebeccarae-claude-marketing-claude-marketing-rebecca-rae-barton_8a108923-a8a63ec1341f.json","docs/sources/src_https-github-com-anthropics-skills-anthropic-agent-skills_04f79b56.md","docs/sources/src_https-github-com-coderabbitai-skills-coderabbit-skills_8f2a22eb.md","docs/sources/src_https-github-com-coreyhaines31-marketingskills-marketing-skills-corey-haines_ef920698.md","docs/sources/src_https-github-com-cuga-project-cuga-agent-cuga-agent-ibm-research_5709bc42.md","docs/sources/src_https-github-com-figma-mcp-server-guide-figma-mcp-skills_dde79ddd.md","docs/sources/src_https-github-com-fujishigetemma-semantic-scholar-mcp-semantic-scholar-mcp-server_1c7ee5c5.md","docs/sources/src_https-github-com-hermeticormus-markdown-discipline-skills-markdown-discipline-skills_ddaf87e0.md","docs/sources/src_https-github-com-jupyterlab-jupyter-ai-jupyter-ai-jupyterlab_e47112b5.md","docs/sources/src_https-github-com-k-dense-ai-scientific-agent-skills-k-dense-scientific-agent-skills_5bdb6d39.md","docs/sources/src_https-github-com-kozz36-frontend-designer-skill-frontend-designer-skill_929a1309.md","docs/sources/src_https-github-com-mcollina-skills-matteo-collina-s-skills_faf2f289.md","docs/sources/src_https-github-com-microsoft-skills-microsoft-agent-skills_0215423e.md","docs/sources/src_https-github-com-openclaw-agent-skills-openclaw-agent-skills_088582b8.md","docs/so